patent_id	title	claim	abstract	class
6917044	High power high yield target for production of all RADIOISOTOPEs for positron emission tomography	1. A target system for confining a material sample to be irradiated with a beam of charged particles for producing a RADIOISOTOPE, the system comprising:a body having a substantially enclosed chamber for confining a material sample to be irradiated with a beam of charged particles;means mounted within the body for heating, when desired, the material sample to an elevated temperature;means associated with the body for preventing the body from exceeding a preselected temperature.	A high power high yield target for the positron emission tomography applications is introduced. For production of Curie level of Fluorine-18 isotope from a beam of proton it uses about one tenth of Oxygen-18 water compared to a conventional water target. The target is also configured to be used for production of all other RADIOISOTOPEs that are used for positron emission tomography. When the target functions as a water target the material sample being oxygen-18 or oxygen-16 water is heated to steam prior to irradiation using heating elements that are housed in the target body. The material sample is kept in steam phase during the irradiation and cooled to liquid phase after irradiation. To keep the material sample in steam phase a microprocessor monitoring the target temperature manipulates the flow of coolant in the cooling section that is attached to the target and the status of the heaters and air blowers mounted adjacent to the target. When the target functions as a gas target the generated heat from the beam is removed from the target by air blowers and the cooling section. The rupture point of the target window is increased by a factor of two or higher by one thin wire or two parallel thin wires welded at the end of a small hollow tube which is held against the target window. One or two coils are used to produce a magnetic filed along the beam path for preventing the density depression along the beam path and suppression of other instabilities that can develop in a high power target.	2AA
6972414	Method and apparatus for production of 213Bi from a high activity 225Ac source	1. An apparatus for the production and purification of a  213 Bi RADIOISOTOPE from an  225 Ac RADIOISOTOPE source comprising:  a. a compatible solvent,    b. a primary column having an inlet, an outlet, and a primary sorbent which preferentially retains  225 Ac over  213 Bi when exposed to said compatible solvent,    c. a secondary column having an inlet and an outlet, said inlet in communication with the outlet of said primary column, said secondary column further having a secondary sorbent which retains  213 Bi when exposed to a mixture of said compatible solvent and  213 Bi.	A method and apparatus for isolating and purifying a  213 Bi radioactive isotope from an  225 Ac source using a primary column and a primary sorbent which preferentially retains  225 Ac over  213 Bi when exposed to a compatible solvent in combination with a secondary column having a secondary sorbent which retains  213 Bi when exposed to a mixture of the compatible solvent and  213 Bi. A “compatible solvent” is a solvent which will preferentially remove  213 Bi radioactive isotopes from a primary sorbent without removing  225 Ac radioactive isotopes, and then allow  213 Bi radioactive isotopes removed from the primary sorbent to be retained on a secondary sorbent, without having to dilute or otherwise chemically or physically modify the compatible solvent in between exposure to the primary and secondary sorbents.	2AD
6974563	Ion exchange materials for the separation of 90Y from 90SR	1. A process, comprising:  (a) preparing a solution containing strontium-90    (b) adsorbing strontium-90 from the solution onto an inorganic ion exchange material; and    (c) eluting yttrium-90 from the inorganic ion exchange material with an aqueous solution.	Inorganic ion exchange materials for the separation of  90 Y from  90 Sr include clinoptilolite, potassium titanosilicate pharmacosiderite, sodium titanosilicate and sodium nonatitanate. These materials are suitable for making a  90 Y generator that contains  90 Sr immobilized on an ion exchange column of the materials. The materials have a very high selectivity for  90 Sr, a very low selectivity for  90 Y, good radiation and thermal stability, low toxicity, fast reaction kinetics, and can be readily and reproducibly synthesized. A method is thus provided for eluting  90 Y from the ion exchange material with an aqueous solution to obtain a carrier-free solution of  90 Y.	2AA
6998052	Multicolumn selectivity inversion generator for production of ultrapure radionuclides	1. A method for producing a solution of desired daughter radionuclide that is substantially free of impurities comprising the steps of:  (a) contacting an aqueous parent-daughter solution containing a desired daughter radionuclide with a first separation medium having a high affinity for the desired daughter radionuclide and a low affinity for the parent and other daughter radionuclides, said desired daughter and parent radionuclides having different (i) ionic charges, (ii) charge densities or (iii) both as they are present in said solution, and maintaining that contact for a time period sufficient for said desired daughter radionuclide to be bound by the first separation medium to form desired daughter-laden separation medium and a desired daughter-depleted parent-daughter solution;    (b) removing the desired daughter-depleted parent daughter solution from the separation medium;    (c) stripping the desired daughter radionuclide from the desired daughter-laden separation medium to form a solution of desired daughter radionuclide;    (e) contacting the solution of desired daughter radionuclide with a second separation medium having a high affinity for the parent radionuclide and a low affinity for said desired daughter radionuclide, and maintaining that contact for a time period sufficient for said parent radionuclide to be bound by the second separation medium to form a solution of substantially impurity-tree desired daughter radionuclide.	A multicolumn selectivity inversion generator separation method has been developed in which a desired daughter radionuclide is selectively extracted from a solution of the parent and daughter radionuclides by a primary separation column, stripped, and passed through a second guard column that retains any parent or other daughter impurities, while the desired daughter elutes. This separation method minimizes the effects of radiation damage to the separation material and permits the reliable production of radionuclides of high chemical and radionuclidic purity for use in diagnostic or therapeutic nuclear medicine.	2AD
7023000	Isotope generator	1. A method for generating a secondary isotope from a precursor isotope comprising:  introducing a charge into a generator system, the charge including a volume of a precursor compound that includes the precursor isotope, the generator system having operating conditions selected to maintain the precursor compound as a gas;    maintaining the charge within the generator system for a period sufficient for a quantity of the precursor compound to decay and produce a target quantity of a secondary compound that includes the secondary isotope;    collecting the secondary compound as a solid on a collection surface within the generator system;    trapping a volume of the precursor compound in a cold trap arranged within the generator system, the cold trap being remote and separable from the collection surface and having operating conditions under which the precursor compound is a liquid or a solid;    eluating the collection surface with an eluant solution to remove a major portion of the secondary compound from the collection surface and form an eluate containing substantially all of the secondary compound;    removing the eluate from the generator system.	Disclosed are a method and an apparatus for generating and collecting a secondary compound that includes daughter isotope, such as  68 Ga, resulting from the decay of a parent isotope, such as  68 Ge, present in a precursor compound. The apparatus includes a generator system comprising a collector vessel, a cold trap and a pump, that are operatively connected to sources for introducing a precursor compound and an eluant solution, and optionally purging gases and oxygen scavengers, into the generator system. In a generation mode a substantial portion of the precursor compound is maintained in or flows through the collector vessel while in recovery mode substantially all of the precursor compound is confined in the cold trap while the collector vessel is flushed with an eluant to remove the collected secondary compound.	2AD
7060998	Component support and RADIOISOTOPE generator including one or more component supports	1. A component support comprising a plate and a cover, wherein:  said plate further comprises a substantially planar plate body defining a spike aperture therethrough, said plate body further comprising first and second opposed deflectable latches extending to either side of said spike aperture, said plate body further defining first and second bracing apertures adjacent to said first and second latches, respectively;    said cover further comprises a planar cover body comprising first and second bracing members insertable through said first and second bracing apertures of said plate body so as to prevent deflection of said first and second latches, respectively, said cover body further defining a spike passageway therethough so as to extend in overlying registry with said spike aperture of said plate body when said bracing members extend through said bracing apertures.	The invention relates to a component support ( 29 ) for use in a RADIOISOTOPE generator, the component support comprising a latching member ( 5 ) movable between an engaging position and an open position characterised by further including a bracing member ( 13 ) mechanically associated with the latching member and adapted to prevent movement of the latching member to the open position.	2AD
7087206	Multicolumn selectivity inversion generator for production of high purity actinium for use in therapeutic nuclear medicine	1. A method for producing a solution of actinium and optionally present radium daughter radionuclide ions that is substantially free of thorium parental radionuclide ion impurities comprising the steps of:  (a) contacting an aqueous parent-daughter radionuclide ion solution having a pH value of about 8 or less that contains sulfate ions as well as thorium parental radionuclide ions and actinium and optionally present radium desired daughter radionuclide ions with a first solid phase separation medium having a high affinity for the desired daughter radionuclide ions and a low affinity for the parent radionuclide ions, and maintaining that contact for a time period sufficient for said actinium and optionally present radium ions to be bound to form a desired daughter ion-laden first separation medium and a thorium ion-containing, desired daughter-depleted parent-daughter solution;    (b) separating the thorium ion-containing desired daughter-depleted parent-daughter solution from the solid phase desired daughter ion-laden first separation medium;    (c) stripping the desired daughter radionuclide from the desired daughter-laden first separation medium with an aqueous nitric or hydrochloric acid solution to form an aqueous nitric or hydrochloric acid solution of actinium and optionally present radium desired daughter radionuclide ions that may contain trace amounts of parental thorium ion impurities;    (d) contacting said aqueous nitric or hydrochloric acid solution of actinium and optionally present radium desired daughter radionuclide ions that may contain trace amounts of parental thorium ion impurities of step (c) with a second solid phase separation medium that has a high affinity for the parent thorium radionuclide ions and a low affinity for the actinium and optionally present radium desired daughter radionuclide, and maintaining that contact for a time period sufficient for the parent thorium radionuclide to be bound by the second solid phase separation medium to form a solution of actinium and optionally present radium desired daughter radionuclide ions that is highly purified and is substantially free of thorium parental radionuclide ion impurities; and    (e) separating the solid and solution phases to provide a solution of actinium and optionally present radium desired daughter radionuclide ions that is highly purified and is substantially free of thorium parental radionuclide ion impurities.	A multicolumn selectivity inversion generator separation method has been developed in which actinium ions, a desired daughter radionuclide, are selectively extracted from a solution of the thorium parent and daughter radionuclides by a primary separation column, stripped, and passed through a second guard column that retains any parent or other daughter interferents, while the desired daughter actinium ions and radium ions elute. This separation method minimizes the effects of radiation damage to the separation material and permits the reliable production of radionuclides of high chemical and radionuclidic purity for use in diagnostic or therapeutic nuclear medicine.	2AD
7091494	RADIOISOTOPE generator	1. A device for producing a fluid containing a radioactive constituent, the device comprising: a shielded chamber within which is located an isotope container housing a radioactive isotope, the shielded chamber including first and second fluid connections to opposing ends of the isotope container and a fluid conduit extending from each of the first and second fluid connections to a fluid inlet and a fluid outlet respectively characterised in that the fluid inlet comprises a single spike comprising a spike body having a substantially circular cross-section, the spike body being adapted to penetrate the rubber seal of a vial and wherein the spike body further defines a first bore extending from a first aperture adjacent the tip of the spike to a fluid connection with the fluid conduit and a second bore extending from a second, separate aperture in the spike body to a filtering air inlet, wherein the spike body incorporates a barrier filter in the second bore.	The invention relates to a device for producing a fluid containing a radioactive constituent, the device comprising: a shielded chamber ( 5 ) within which is located an isotope container ( 6 ) housing a radioactive isotope ( 7 ), the shielded chamber including first and second fluid connections ( 12,13 ) to opposing ends of the isotope container and a fluid conduit ( 14,15 ) extending from each of the first and second fluid connections to a fluid inlet ( 16 ) and a fluid outlet ( 17 ) respectively characterised in that the fluid inlet comprises a single spike ( 22 ) having a substantially circular cross-section, the spike being adapted to penetrate the rubber seal of a vial and the spike having two bores, the first bore extending from a first aperture adjacent the tip of the spike to a fluid connection with the fluid conduit and the second bore extending from a second, separate aperture in the spike to a filtering air inlet.	2AD
7101484	Sr-90/Y-90 radionuclide generator for production of high-quality Y-90 solution	1. A process for separating radioactive isotope yttrium-90 from a stock solution containing radioactive strontium-90, , the stock solution having colloidal and suspended radioactive and chemical impurities, the process comprising:  a. adjusting said stock solution composition by adding a calculated quantity of sodium chloride and alkaline, whereby the solution is brought to a NaCl concentration of approximately 1 mole/liter and has a pH in the range of 3.5 to 4.0;    b. passing said adjusted stock solution through a first chromatographic column containing a first thermoxide-type sorbent;    c. passing said adjusted stock solution through a second chromatographic column containing a second thermoxide sorbent, whereby colloidal, suspended and ion forms of radioactive and chemical impurities are held in said first and second thermoxide-type sorbents and a purified Sr-90 filtrate is passed into a Sr-90 filtrate tank;    d. testing said purified Sr-90 filtrate for purity and passing it to a Sr-90 holding tank if purity requirements are met or re-passing it through said first and second thermoxide-type sorbents a second time;    e. adjusting the pH of said purified Sr-90 filtrate in said Sr-90 holding tank to approximately 3 to 4;    f. holding said purified Sr-90 filtrate in said Sr-90 holding tank to permit the ingrowth of Y-90 forming a Sr-90/Y-90 solution;    g. passing said strontium-90/yttrium-90 solution through a third chromatographic column containing said first thermoxide-type sorbent, whereby Y-90 is preferentially sorbed while Sr-90 solution is passed through said third chromatographic column and held in an intermediate holding tank for subsequent reuse;    h. washing said first thermoxide-type sorbent of the third chromatographic column with a NaCl solution to thereby remove any remaining traces of Sr-90 and thereafter passing said NaCl solution to a waste tank;    i. washing said first thermoxide-type sorbent of the third chromatographic column with a distilled water solution to thereby remove any remaining NaCl and thereafter passing said water solution to said waste tank;    j. eluting the Y-90 from said first thermoxide-type sorbent of the third chromatographic column with HCl acid and accumulating the acidic Y-90 solution in a first Y-90 tank;    k. passing said acidic Y-90 solution after pH correction from the first Y-90 tank through a fourth chromatographic column containing said first thermoxide-type sorbent, whereby Y-90 is preferentially sorbed by said sorbent;    l. repeating said h, i, and j steps while accumulating the acidic Y-90 solution in a second Y-90 tank, this Y-90 solution constituting the final product.	A process for purifying a stock Sr-90 solution containing stable and radioactive impurities, holding the purified Sr-90 solution for Y-90 ingrowth, and subsequently extracting the Y-90 from the Sr-90/Y-90 solution. The stock solution is sequentially passed through two thermoxide-type sorbents (T- 3  and T- 5 ), which hold the impurities while passing the Sr-90 solution. After ingrowth of Y-90, the Sr-90/Y-90 solution is passed through sorbent T- 3,  which preferentially sorbs the Y-90 while passing the Sr-90 solution. The Y-90 is then eluted from the T- 3  sorbent. The T- 3  and T- 5  sorbents are specially prepared compounds of zirconium dioxide and titanium dioxide, respectively, that preferentially sorb Y-90 under predetermined conditions of solution pH and NaCl concentration.	2AD
7127023	Batch target and method for producing radionuclide	1. A radionuclide producing apparatus, comprising:  (a) a target chamber comprising a beam strike region for containing a target liquid, a target chamber lower opening communicating with the beam strike region, a condenser region for containing a vapor, and a sealable top above the condenser region, the condenser region disposed above the beam strike region in fluid communication therewith for receiving heat energy from the beam strike region and transferring condensate to the beam strike region;    (b) a particle beam source operatively aligned with the beam strike region for bombarding the beam strike region with a particle beam;    (c) a target liquid expansion chamber including an expansion chamber upper opening and an expansion chamber lower opening, the expansion chamber openly fluidly communicating with the beam strike region via the expansion chamber lower opening and the target chamber lower opening;    (d) a pressurizing gas supply source separate from the target chamber and fluidly communicating with the expansion chamber upper opening; and    (e) a lower liquid conduit interposed between the target chamber lower opening and the expansion chamber lower opening and forming an open target liquid flow path between the target chamber and the expansion chamber, wherein the expansion chamber, the lower liquid conduit, and the beam strike region are pressurized by the gas supply source.	An apparatus for producing a radionuclide includes a target chamber including a beam strike region for containing a liquid and a condenser region for containing a vapor. A particle beam source is operatively aligned with the beam strike region, and a lower liquid conduit communicates with the beam strike region. The condenser region is disposed above the beam strike region in fluid communication therewith for receiving heat energy from the beam strike region and transferring condensate to the beam strike region. The lower liquid conduit transfers liquid to and from the beam strike region. In operation, the target chamber acts as a thermosyphon that is self-regulating in response to heat energy deposited by the particle beam source. A portion of the liquid expands into the lower liquid conduit prior to boiling. After boiling begins, a vapor void is created above the liquid and an evaporation/condensation cycle is established, with additional liquid being displaced into the lower liquid conduit.	2AB
7138643	Method and apparatus for separating ions of metallic elements in aqueous solution	1. A  99m Tc generator comprising:  (a) a body portion having an inlet and an outlet; and  (b) an ion exchange housed within said body portion, said ion exchange comprising carbon or graphite fibers impregnated with an acidic organophosphorus extractant selected from the group consisting of DEHPA, EHEHPA, and DTMPPA, and said ion exchange further comprising ions of  99 Mo bound to said extractant.	Methods and apparatus for separating ions of metallic elements are provided. Preferred methods utilize a hydrophobic chelating extractant, such as an organophosphorus compound, adsorbed onto carbon or graphite fibers in the form of felt. Also described is a new thallium-201 generator that comprises a column containing an acidic organophosphorus extractant adsorbed on carbon or graphite fibers, and a yttrium-90 generator system comprised of two extraction columns designed to selectively absorb yttrium-90 at different pH, to enable the separation of yttrium-90 from strontium-90. The two columns are connected in series for stepwise separation. The yttrium-90 product is freed from residual strontium-90 and metal contaminants and can be eluted from the second column with dilute acid, acetate buffer, water or saline for labeling biological targeted molecules. The new generator system provides rapid and efficient separation of yttrium-90 and is amenable to both scale-up and automation. Also described is a new  99m Tc generator that comprises a column containing an acidic organophosphorus extractant adsorbed on carbon or graphite fibers designed to selectively absorb  99 Mo at a selected pH, to enable the separation of  99m Tc from  99 Mo.	2AB
7200198	Recirculating target and method for producing radionuclide	1. A fluorine-18 ion (  18 F  − ) recirculating-target radionuclide producing apparatus, comprising:  (a) a target chamber comprising a target inlet port and a target outlet port and including oxygen-18 enriched target liquid;    (b) means for applying a proton beam to the target chamber for irradiating the oxygen-18 enriched target liquid in the target chamber at a beam power of 1.0 kW or greater;    (c) a regenerative turbine pump comprising a pump inlet port and a pump outlet port;    (d) a heat exchanging section disposed externally from the target chamber and interposed between the target chamber and the regenerative turbine pump;    (e) a first liquid transport conduit interconnecting the pump outlet port and the target inlet port; and    (f) a second liquid transport conduit extending through the heat exchanging section and interconnecting the target outlet port and the pump inlet port.	An apparatus for producing a radionuclide includes a target chamber, a particle beam source operatively aligned with the target chamber, and a regenerative turbine pump for circulating a target fluid through the target chamber via first and second liquid transports. During bombardment of the target liquid in the target chamber by the particle beam source, the target liquid is prevented from reaching vaporization due to the elevated pressure within the target chamber and/or the rapid flow rate through the target chamber. A cooling system can be provided to circulate coolant to the first and second liquid transport conduits, the target chamber and the pump to ensure that the target liquid is cooled upon recirculation back into the target chamber.	2AC
7316644	Method for preparing particles of radioactive powder containing Cesium-131 for use in brachytherapy sources	1. A method for preparing particles of radioactive powder containing Cs-131, comprising the step of contacting Cs-131 with a material to produce microparticles of radioactive powder containing Cs-131, wherein the material comprises a crystalline silicotitanate and an aluminosilicate.	The present invention provides a method of preparing Cesium-131 (Cs-131) as a dispersed RADIOISOTOPE. Uses of the dispersed Cs-131 prepared by the method include cancer research and treatment, such as for the use in brachytherapy. Cs-131 is particularly useful in the treatment of faster growing tumors.	2AB
